{
  "schema_version": "tess.adapter-manifest.v1",
  "adapter_id": "codex",
  "provider": "OpenAI Codex",
  "support_level": "C2",
  "status": "preview",
  "capabilities": ["instruction-rendering", "prompt-artifacts", "config-fragment", "local-process-driver"],
  "evidence": [
    {"kind": "repository-source", "path": "adapters/codex/README.md", "note": "Documents the rendered AGENTS.md, config, Agent Skills (.agents/skills/tess-*), and local process-driver boundary."},
    {"kind": "status-page", "path": "docs/STATUS.md", "note": "Records that Codex has no protected-workflow or native-parity certification."}
  ],
  "limits": [
    "C2 is manual-gated compatibility, not native-parity or protected-workflow certification.",
    "The current driver has not been live-tested against native event samples.",
    "The adapter cannot mint approvals, verifier keys, verdicts, sign-offs, or branch-protection status."
  ]
}
